{
  "$schema": "http://json-schema.org/draft-07/schema#",
  "title": "Projects Registry",
  "type": "array",
  "items": {
    "type": "object",
    "required": ["name", "url", "status"],
    "properties": {
      "name": { "type": "string", "description": "Project slug, e.g. portfolio-luiszmarques" },
      "display_name": { "type": "string" },
      "url": { "type": "string", "format": "uri" },
      "stack": { "type": "array", "items": { "type": "string" } },
      "workflows": { "type": "array", "items": { "type": "string" } },
      "status": { "type": "string", "enum": ["active", "archived", "planned"] },
      "local_path": { "type": "string" }
    },
    "additionalProperties": false
  }
}
